{
    "$schema": "http://json-schema.org/schema#",
    "properties": {
        "encounter_method_rates": {
            "items": {
                "properties": {
                    "encounter_method": {
                        "$ref": "/schema/v2/named_api_resource.json"
                    },
                    "version_details": {
                        "items": {
                            "properties": {
                                "rate": {
                                    "type": "integer"
                                },
                                "version": {
                                    "$ref": "/schema/v2/named_api_resource.json"
                                }
                            },
                            "required": [
                                "rate",
                                "version"
                            ],
                            "type": "object"
                        },
                        "type": "array"
                    }
                },
                "required": [
                    "encounter_method",
                    "version_details"
                ],
                "type": "object"
            },
            "type": "array"
        },
        "game_index": {
            "type": "integer"
        },
        "id": {
            "type": "integer"
        },
        "location": {
            "$ref": "/schema/v2/named_api_resource.json"
        },
        "name": {
            "type": "string"
        },
        "names": {
            "items": {
                "$ref": "/schema/v2/name.json"
            },
            "type": "array"
        },
        "pokemon_encounters": {
            "items": {
                "properties": {
                    "pokemon": {
                        "$ref": "/schema/v2/named_api_resource.json"
                    },
                    "version_details": {
                        "items": {
                            "properties": {
                                "encounter_details": {
                                    "items": {
                                        "properties": {
                                            "chance": {
                                                "type": "integer"
                                            },
                                            "condition_values": {
                                                "items": {
                                                    "$ref": "/schema/v2/named_api_resource.json"
                                                },
                                                "type": "array"
                                            },
                                            "max_level": {
                                                "type": "integer"
                                            },
                                            "method": {
                                                "$ref": "/schema/v2/named_api_resource.json"
                                            },
                                            "min_level": {
                                                "type": "integer"
                                            },
                                            "pokemon_details": {
                                                "anyOf": [
                                                    {
                                                        "type": "null"
                                                    },
                                                    {
                                                        "properties": {
                                                            "always_shiny": {
                                                                "type": "boolean"
                                                            },
                                                            "is_alpha": {
                                                                "type": "boolean"
                                                            },
                                                            "min_perfect_ivs": {
                                                                "type": "null"
                                                            },
                                                            "never_shiny": {
                                                                "type": "boolean"
                                                            }
                                                        },
                                                        "required": [
                                                            "always_shiny",
                                                            "is_alpha",
                                                            "min_perfect_ivs",
                                                            "never_shiny"
                                                        ],
                                                        "type": "object"
                                                    }
                                                ]
                                            }
                                        },
                                        "required": [
                                            "chance",
                                            "condition_values",
                                            "max_level",
                                            "method",
                                            "min_level",
                                            "pokemon_details"
                                        ],
                                        "type": "object"
                                    },
                                    "type": "array"
                                },
                                "max_chance": {
                                    "type": "integer"
                                },
                                "version": {
                                    "$ref": "/schema/v2/named_api_resource.json"
                                }
                            },
                            "required": [
                                "encounter_details",
                                "max_chance",
                                "version"
                            ],
                            "type": "object"
                        },
                        "type": "array"
                    }
                },
                "required": [
                    "pokemon",
                    "version_details"
                ],
                "type": "object"
            },
            "type": "array"
        }
    },
    "required": [
        "encounter_method_rates",
        "game_index",
        "id",
        "location",
        "name",
        "names",
        "pokemon_encounters"
    ],
    "type": "object"
}