{
    "encounter_method_rates": [],
    "game_index": 0,
    "id": 1207,
    "location": {
        "name": "hoenn-route-104",
        "url": "/api/v2/location/452/"
    },
    "name": "hoenn-route-104-north-oras",
    "names": [],
    "pokemon_encounters": [
        {
            "pokemon": {
                "name": "zigzagoon",
                "url": "/api/v2/pokemon/263/"
            },
            "version_details": [
                {
                    "encounter_details": [
                        {
                            "chance": 95,
                            "condition_values": [],
                            "max_level": 2,
                            "method": {
                                "name": "horde",
                                "url": "/api/v2/encounter-method/44/"
                            },
                            "min_level": 2,
                            "pokemon_details": null
                        }
                    ],
                    "max_chance": 95,
                    "version": {
                        "name": "omega-ruby",
                        "url": "/api/v2/version/25/"
                    }
                },
                {
                    "encounter_details": [
                        {
                            "chance": 95,
                            "condition_values": [],
                            "max_level": 2,
                            "method": {
                                "name": "horde",
                                "url": "/api/v2/encounter-method/44/"
                            },
                            "min_level": 2,
                            "pokemon_details": null
                        }
                    ],
                    "max_chance": 95,
                    "version": {
                        "name": "alpha-sapphire",
                        "url": "/api/v2/version/26/"
                    }
                }
            ]
        },
        {
            "pokemon": {
                "name": "taillow",
                "url": "/api/v2/pokemon/276/"
            },
            "version_details": [
                {
                    "encounter_details": [
                        {
                            "chance": 5,
                            "condition_values": [],
                            "max_level": 3,
                            "method": {
                                "name": "horde",
                                "url": "/api/v2/encounter-method/44/"
                            },
                            "min_level": 3,
                            "pokemon_details": null
                        }
                    ],
                    "max_chance": 5,
                    "version": {
                        "name": "omega-ruby",
                        "url": "/api/v2/version/25/"
                    }
                },
                {
                    "encounter_details": [
                        {
                            "chance": 5,
                            "condition_values": [],
                            "max_level": 3,
                            "method": {
                                "name": "horde",
                                "url": "/api/v2/encounter-method/44/"
                            },
                            "min_level": 3,
                            "pokemon_details": null
                        }
                    ],
                    "max_chance": 5,
                    "version": {
                        "name": "alpha-sapphire",
                        "url": "/api/v2/version/26/"
                    }
                }
            ]
        }
    ]
}