{
    "encounter_method_rates": [],
    "game_index": 0,
    "id": 1665,
    "location": {
        "name": "olivine-city",
        "url": "/api/v2/location/85/"
    },
    "name": "olivine-city-gym",
    "names": [
        {
            "language": {
                "name": "en",
                "url": "/api/v2/language/9/"
            },
            "name": "Olivine City Gym"
        }
    ],
    "pokemon_encounters": [
        {
            "pokemon": {
                "name": "steelix",
                "url": "/api/v2/pokemon/208/"
            },
            "version_details": [
                {
                    "encounter_details": [
                        {
                            "chance": 100,
                            "condition_values": [
                                {
                                    "name": "trade-any-pokemon",
                                    "url": "/api/v2/encounter-condition-value/361/"
                                }
                            ],
                            "max_level": 100,
                            "method": {
                                "name": "npc-trade",
                                "url": "/api/v2/encounter-method/36/"
                            },
                            "min_level": 1,
                            "pokemon_details": null
                        }
                    ],
                    "max_chance": 100,
                    "version": {
                        "name": "heartgold",
                        "url": "/api/v2/version/15/"
                    }
                },
                {
                    "encounter_details": [
                        {
                            "chance": 100,
                            "condition_values": [
                                {
                                    "name": "trade-any-pokemon",
                                    "url": "/api/v2/encounter-condition-value/361/"
                                }
                            ],
                            "max_level": 100,
                            "method": {
                                "name": "npc-trade",
                                "url": "/api/v2/encounter-method/36/"
                            },
                            "min_level": 1,
                            "pokemon_details": null
                        }
                    ],
                    "max_chance": 100,
                    "version": {
                        "name": "soulsilver",
                        "url": "/api/v2/version/16/"
                    }
                }
            ]
        }
    ]
}