{
  "id": 1340,
  "name": "unova-route-2-hidden-grotto",
  "game_index": 15,
  "encounter_method_rates": [
    {
      "encounter_method": {
        "name": "hidden-grotto",
        "url": "/api/v2/encounter-method/54/"
      },
      "version_details": [
        {
          "rate": 20,
          "version": {
            "name": "black-2",
            "url": "/api/v2/version/21/"
          }
        },
        {
          "rate": 20,
          "version": {
            "name": "white-2",
            "url": "/api/v2/version/22/"
          }
        }
      ]
    }
  ],
  "location": {
    "name": "unova-route-2",
    "url": "/api/v2/location/357/"
  },
  "names": [
    {
      "name": "Route 2 (Hidden Grotto)",
      "language": {
        "name": "en",
        "url": "/api/v2/language/9/"
      }
    },
    {
      "name": "Route 2 (Trouée Cachée)",
      "language": {
        "name": "fr",
        "url": "/api/v2/language/5/"
      }
    }
  ],
  "pokemon_encounters": [
    {
      "pokemon": {
        "name": "nidoran-f",
        "url": "/api/v2/pokemon/29/"
      },
      "version_details": [
        {
          "version": {
            "name": "black-2",
            "url": "/api/v2/version/21/"
          },
          "max_chance": 10,
          "encounter_details": [
            {
              "min_level": 55,
              "max_level": 59,
              "chance": 10,
              "method": {
                "name": "hidden-grotto",
                "url": "/api/v2/encounter-method/54/"
              },
              "condition_values": [],
              "pokemon_details": null
            }
          ]
        },
        {
          "version": {
            "name": "white-2",
            "url": "/api/v2/version/22/"
          },
          "max_chance": 10,
          "encounter_details": [
            {
              "min_level": 55,
              "max_level": 59,
              "chance": 10,
              "method": {
                "name": "hidden-grotto",
                "url": "/api/v2/encounter-method/54/"
              },
              "condition_values": [],
              "pokemon_details": null
            }
          ]
        }
      ]
    },
    {
      "pokemon": {
        "name": "nidoran-m",
        "url": "/api/v2/pokemon/32/"
      },
      "version_details": [
        {
          "version": {
            "name": "black-2",
            "url": "/api/v2/version/21/"
          },
          "max_chance": 10,
          "encounter_details": [
            {
              "min_level": 55,
              "max_level": 59,
              "chance": 10,
              "method": {
                "name": "hidden-grotto",
                "url": "/api/v2/encounter-method/54/"
              },
              "condition_values": [],
              "pokemon_details": null
            }
          ]
        },
        {
          "version": {
            "name": "white-2",
            "url": "/api/v2/version/22/"
          },
          "max_chance": 10,
          "encounter_details": [
            {
              "min_level": 55,
              "max_level": 59,
              "chance": 10,
              "method": {
                "name": "hidden-grotto",
                "url": "/api/v2/encounter-method/54/"
              },
              "condition_values": [],
              "pokemon_details": null
            }
          ]
        }
      ]
    },
    {
      "pokemon": {
        "name": "granbull",
        "url": "/api/v2/pokemon/210/"
      },
      "version_details": [
        {
          "version": {
            "name": "black-2",
            "url": "/api/v2/version/21/"
          },
          "max_chance": 5,
          "encounter_details": [
            {
              "min_level": 55,
              "max_level": 59,
              "chance": 5,
              "method": {
                "name": "hidden-grotto",
                "url": "/api/v2/encounter-method/54/"
              },
              "condition_values": [],
              "pokemon_details": null
            }
          ]
        },
        {
          "version": {
            "name": "white-2",
            "url": "/api/v2/version/22/"
          },
          "max_chance": 5,
          "encounter_details": [
            {
              "min_level": 55,
              "max_level": 59,
              "chance": 5,
              "method": {
                "name": "hidden-grotto",
                "url": "/api/v2/encounter-method/54/"
              },
              "condition_values": [],
              "pokemon_details": null
            }
          ]
        }
      ]
    },
    {
      "pokemon": {
        "name": "watchog",
        "url": "/api/v2/pokemon/505/"
      },
      "version_details": [
        {
          "version": {
            "name": "black-2",
            "url": "/api/v2/version/21/"
          },
          "max_chance": 75,
          "encounter_details": [
            {
              "min_level": 55,
              "max_level": 59,
              "chance": 75,
              "method": {
                "name": "hidden-grotto",
                "url": "/api/v2/encounter-method/54/"
              },
              "condition_values": [],
              "pokemon_details": null
            }
          ]
        },
        {
          "version": {
            "name": "white-2",
            "url": "/api/v2/version/22/"
          },
          "max_chance": 75,
          "encounter_details": [
            {
              "min_level": 55,
              "max_level": 59,
              "chance": 75,
              "method": {
                "name": "hidden-grotto",
                "url": "/api/v2/encounter-method/54/"
              },
              "condition_values": [],
              "pokemon_details": null
            }
          ]
        }
      ]
    }
  ]
}