{
    "encounter_method_rates": [],
    "game_index": 0,
    "id": 1173,
    "location": {
        "name": "twist-mountain",
        "url": "/api/v2/location/380/"
    },
    "name": "twist-mountain-b4f",
    "names": [],
    "pokemon_encounters": [
        {
            "pokemon": {
                "name": "regigigas",
                "url": "/api/v2/pokemon/486/"
            },
            "version_details": [
                {
                    "encounter_details": [
                        {
                            "chance": 100,
                            "condition_values": [
                                {
                                    "name": "other-regirock-regice-registeel-in-party",
                                    "url": "/api/v2/encounter-condition-value/58/"
                                }
                            ],
                            "max_level": 68,
                            "method": {
                                "name": "static",
                                "url": "/api/v2/encounter-method/20/"
                            },
                            "min_level": 68,
                            "pokemon_details": null
                        }
                    ],
                    "max_chance": 100,
                    "version": {
                        "name": "black-2",
                        "url": "/api/v2/version/21/"
                    }
                },
                {
                    "encounter_details": [
                        {
                            "chance": 100,
                            "condition_values": [
                                {
                                    "name": "other-regirock-regice-registeel-in-party",
                                    "url": "/api/v2/encounter-condition-value/58/"
                                }
                            ],
                            "max_level": 68,
                            "method": {
                                "name": "static",
                                "url": "/api/v2/encounter-method/20/"
                            },
                            "min_level": 68,
                            "pokemon_details": null
                        }
                    ],
                    "max_chance": 100,
                    "version": {
                        "name": "white-2",
                        "url": "/api/v2/version/22/"
                    }
                }
            ]
        }
    ]
}