{
    "encounter_method_rates": [],
    "game_index": 0,
    "id": 812,
    "location": {
        "name": "ancient-tomb",
        "url": "/api/v2/location/583/"
    },
    "name": "ancient-tomb-area",
    "names": [
        {
            "language": {
                "name": "en",
                "url": "/api/v2/language/9/"
            },
            "name": "Ancient Tomb"
        },
        {
            "language": {
                "name": "de",
                "url": "/api/v2/language/6/"
            },
            "name": "Grabmal"
        },
        {
            "language": {
                "name": "fr",
                "url": "/api/v2/language/5/"
            },
            "name": "Tombeau Antique"
        }
    ],
    "pokemon_encounters": [
        {
            "pokemon": {
                "name": "registeel",
                "url": "/api/v2/pokemon/379/"
            },
            "version_details": [
                {
                    "encounter_details": [
                        {
                            "chance": 100,
                            "condition_values": [],
                            "max_level": 40,
                            "method": {
                                "name": "static",
                                "url": "/api/v2/encounter-method/20/"
                            },
                            "min_level": 40,
                            "pokemon_details": null
                        }
                    ],
                    "max_chance": 100,
                    "version": {
                        "name": "ruby",
                        "url": "/api/v2/version/7/"
                    }
                },
                {
                    "encounter_details": [
                        {
                            "chance": 100,
                            "condition_values": [],
                            "max_level": 40,
                            "method": {
                                "name": "static",
                                "url": "/api/v2/encounter-method/20/"
                            },
                            "min_level": 40,
                            "pokemon_details": null
                        }
                    ],
                    "max_chance": 100,
                    "version": {
                        "name": "sapphire",
                        "url": "/api/v2/version/8/"
                    }
                },
                {
                    "encounter_details": [
                        {
                            "chance": 100,
                            "condition_values": [],
                            "max_level": 40,
                            "method": {
                                "name": "static",
                                "url": "/api/v2/encounter-method/20/"
                            },
                            "min_level": 40,
                            "pokemon_details": null
                        }
                    ],
                    "max_chance": 100,
                    "version": {
                        "name": "emerald",
                        "url": "/api/v2/version/9/"
                    }
                },
                {
                    "encounter_details": [
                        {
                            "chance": 100,
                            "condition_values": [],
                            "max_level": 40,
                            "method": {
                                "name": "static",
                                "url": "/api/v2/encounter-method/20/"
                            },
                            "min_level": 40,
                            "pokemon_details": null
                        }
                    ],
                    "max_chance": 100,
                    "version": {
                        "name": "omega-ruby",
                        "url": "/api/v2/version/25/"
                    }
                },
                {
                    "encounter_details": [
                        {
                            "chance": 100,
                            "condition_values": [],
                            "max_level": 40,
                            "method": {
                                "name": "static",
                                "url": "/api/v2/encounter-method/20/"
                            },
                            "min_level": 40,
                            "pokemon_details": null
                        }
                    ],
                    "max_chance": 100,
                    "version": {
                        "name": "alpha-sapphire",
                        "url": "/api/v2/version/26/"
                    }
                }
            ]
        }
    ]
}